{"artifact_candidate":{"bindings":{"artifact_profile":"01384aaad3bcb3b5f43eb0c5fd72e8ed334271eae52b4da1596c9b8160964dba","plan":"c57c689d52cbb7adc37b265c1e6d29c378a9e3c998c3e67764399c5d9cb40dbd","request":"eea991edf96ca3d167d3bf83ad7d6d07fead1b2c6b34adf8a1a91cfa60a60782","snapshot":"08c6be17e75a78a222149f19673f3e4a29c77876d0fbe3ec86e0fbfb5dd41d0d","trace_profile":"f7fe4eec7439e99d5dbc9c6ddfd01166fcb9409a39a8edef7534a222b58c137f","workflow_package":"22b8ff2654ef362cdcfe29bf80939c540a3a076295107501ea8efe8c62938ab4"},"candidate_identity":"b585c4c01e8dd3e798438ff1c1238cf75100dd3ed99b8d6173fbc69962674910","digest":"2f10d6441d6da27d3ea32a7f0013f9fe4f803f9ed3962d71d4230a6e078ed8af","index_digest":"195bd0820e6484a2ba6c387b45bfdb20563fa7e06eb308bb1e9662cd4e69f803","native_receipt_digest":"10b6ec2a7ca41270302111d7579f6114cdacc94aef8e5856f89a348905de20fa"},"artifact_report":{"digest":"4e00c9926a851e595e40aab95226bab699f3bd751ca62e302b187b04c764355f","expected_obligation_ids":["OBL-06C5E13838BBA9A4285A","OBL-258C9D754A4A7F4D19E3","OBL-7C95072B3AEC46875137","OBL-89C3690FAF6D0D73BF66","OBL-BE57782C5FDF51D55A87","OBL-CC89A77302EA162D9FA5","OBL-D1D31CB1C97C001B9AAE","OBL-FFEB2D1788251B7A8600"],"index_digest":"195bd0820e6484a2ba6c387b45bfdb20563fa7e06eb308bb1e9662cd4e69f803","status":"passed"},"assurance_domain":"fixture_contract","digest":"78d14c5ee0ead4d1802342e39833fbb804cf96070a7b48626d9b85423f02e12e","expected_obligation_ids":["OBL-06C5E13838BBA9A4285A","OBL-258C9D754A4A7F4D19E3","OBL-7C95072B3AEC46875137","OBL-89C3690FAF6D0D73BF66","OBL-BE57782C5FDF51D55A87","OBL-CC89A77302EA162D9FA5","OBL-D1D31CB1C97C001B9AAE","OBL-FFEB2D1788251B7A8600","obligation-a","obligation-b"],"file_closure":[{"path":"index.rst","role":"base","sha256":"fc1fa4627b1ce1c3a569311a7fcaf51fa36c05f4fd672f94f37a6689e05b9889"},{"path":"index.rst","role":"overlay","sha256":"b61e1d2551795acc10fce2d6b5d4916e995f2716f38cd537618348abc836e3aa"}],"kind":"assurance_subject","limitations":[],"plan":{"digest":"c57c689d52cbb7adc37b265c1e6d29c378a9e3c998c3e67764399c5d9cb40dbd","instances":[{"disposition":"create","id":"obligation-a"},{"disposition":"create","id":"obligation-b"}],"semantic_inputs":{},"target_namespace":"fixture-target"},"policy_bindings":{},"process_baseline":{},"profiles":{"artifact":"01384aaad3bcb3b5f43eb0c5fd72e8ed334271eae52b4da1596c9b8160964dba","trace":"f7fe4eec7439e99d5dbc9c6ddfd01166fcb9409a39a8edef7534a222b58c137f"},"schema_version":1,"scope":{"id":"component-005","kind":"component","purpose":"fixture verification"},"source_baselines":[{"commit":"c4d4ad0000000000000000000000000000000000","repository":"https://github.com/eclipse-score/score","revision_label":"fixture-v1","source_id":"score","source_lock":"upstream.lock.yaml"}],"toolchain":{"commands":["fixture-needs-json","fixture-docs-check"],"native_validator":{"fixture_only":true,"id":"fixture-native-adapter"}}}
